[
  {
    "attempt_id": "att-synthetic-valid-1",
    "claim_id": "claim-synthetic-valid-1",
    "status": "succeeded",
    "started_at": "2026-08-09T10:05:00+08:00",
    "finished_at": "2026-08-09T10:18:00+08:00",
    "synthetic": true,
    "execution_environment": "synthetic",
    "model_capability_tier": "general-purpose-tier-b",
    "self_reported_usage": {
      "self_reported": true,
      "model_calls_range": "1-3",
      "wall_clock_minutes_range": "10-15",
      "notes": "SYNTHETIC 自报值；未经核实"
    }
  }
]
